{
  "schema_version": "liqi.infrastructure.database-credentials/v1",
  "status": "planned",
  "bundle_sha256": "0000000000000000000000000000000000000000000000000000000000000000",
  "roles": [
    "liqi_migrator",
    "liqi_api",
    "liqi_realtime",
    "liqi_worker",
    "liqi_readonly",
    "liqi_monitor",
    "liqi_backup"
  ],
  "runtime_bundle_path": "/run/liqi/secrets/beam/database-role-urls",
  "pgbouncer_userlist_path": "/run/liqi/secrets/database/pgbouncer-userlist.txt",
  "approval_reference": null,
  "observed_at": "2026-07-18T00:00:00Z",
  "database_mutation_performed": false
}
